{
  "schemaVersion": 1,
  "languageId": "nqo",
  "layoutId": "nko-standard",
  "layoutName": "N'Ko",
  "languageName": "N'Ko",
  "nativeName": "ߒߞߏ",
  "localeTag": "nqo",
  "script": "Nkoo",
  "direction": "rtl",
  "hasCase": false,
  "inputProcessing": {
    "mode": "direct",
    "combining": true,
    "composition": false
  },
  "provenance": {
    "reference": "https://www.branah.com/nko",
    "verification": "json-valid",
    "notes": "N'Ko is a West-African script written right-to-left. Vowels and consonants are arranged across 4 rows as a best-effort; tone marks and diacritics are not fully represented. Verify against branah.com/nko."
  },
  "rows": [
    {
      "rowId": "row-0",
      "keys": [
        {
          "keyId": "row-0-1",
          "normal": "߁",
          "shift": "߁"
        },
        {
          "keyId": "row-0-2",
          "normal": "߂",
          "shift": "߂"
        },
        {
          "keyId": "row-0-3",
          "normal": "߃",
          "shift": "߃"
        },
        {
          "keyId": "row-0-4",
          "normal": "߄",
          "shift": "߄"
        },
        {
          "keyId": "row-0-5",
          "normal": "߅",
          "shift": "߅"
        },
        {
          "keyId": "row-0-6",
          "normal": "߆",
          "shift": "߆"
        },
        {
          "keyId": "row-0-7",
          "normal": "߇",
          "shift": "߇"
        },
        {
          "keyId": "row-0-8",
          "normal": "߈",
          "shift": "߈"
        },
        {
          "keyId": "row-0-9",
          "normal": "߉",
          "shift": "߉"
        },
        {
          "keyId": "row-0-10",
          "normal": "߀",
          "shift": "߀"
        }
      ]
    },
    {
      "rowId": "row-1",
      "keys": [
        {
          "keyId": "row-1-1",
          "normal": "ߊ",
          "shift": "ߊ"
        },
        {
          "keyId": "row-1-2",
          "normal": "ߋ",
          "shift": "ߋ"
        },
        {
          "keyId": "row-1-3",
          "normal": "ߌ",
          "shift": "ߌ"
        },
        {
          "keyId": "row-1-4",
          "normal": "ߍ",
          "shift": "ߍ"
        },
        {
          "keyId": "row-1-5",
          "normal": "ߎ",
          "shift": "ߎ"
        },
        {
          "keyId": "row-1-6",
          "normal": "ߏ",
          "shift": "ߏ"
        },
        {
          "keyId": "row-1-7",
          "normal": "ߐ",
          "shift": "ߐ"
        },
        {
          "keyId": "row-1-8",
          "normal": "ߑ",
          "shift": "ߑ"
        },
        {
          "keyId": "row-1-9",
          "normal": "ߒ",
          "shift": "ߒ"
        },
        {
          "keyId": "row-1-10",
          "normal": "ߓ",
          "shift": "ߓ"
        }
      ]
    },
    {
      "rowId": "row-2",
      "keys": [
        {
          "keyId": "row-2-1",
          "normal": "ߔ",
          "shift": "ߔ"
        },
        {
          "keyId": "row-2-2",
          "normal": "ߕ",
          "shift": "ߕ"
        },
        {
          "keyId": "row-2-3",
          "normal": "ߖ",
          "shift": "ߖ"
        },
        {
          "keyId": "row-2-4",
          "normal": "ߗ",
          "shift": "ߗ"
        },
        {
          "keyId": "row-2-5",
          "normal": "ߘ",
          "shift": "ߘ"
        },
        {
          "keyId": "row-2-6",
          "normal": "ߙ",
          "shift": "ߙ"
        },
        {
          "keyId": "row-2-7",
          "normal": "ߚ",
          "shift": "ߚ"
        },
        {
          "keyId": "row-2-8",
          "normal": "ߛ",
          "shift": "ߛ"
        },
        {
          "keyId": "row-2-9",
          "normal": "ߜ",
          "shift": "ߜ"
        },
        {
          "keyId": "row-2-10",
          "normal": "ߝ",
          "shift": "ߝ"
        }
      ]
    },
    {
      "rowId": "row-3",
      "keys": [
        {
          "keyId": "row-3-1",
          "normal": "ߞ",
          "shift": "ߞ"
        },
        {
          "keyId": "row-3-2",
          "normal": "ߟ",
          "shift": "ߟ"
        },
        {
          "keyId": "row-3-3",
          "normal": "ߠ",
          "shift": "ߠ"
        },
        {
          "keyId": "row-3-4",
          "normal": "ߡ",
          "shift": "ߡ"
        },
        {
          "keyId": "row-3-5",
          "normal": "ߢ",
          "shift": "ߢ"
        },
        {
          "keyId": "row-3-6",
          "normal": "ߣ",
          "shift": "ߣ"
        },
        {
          "keyId": "row-3-7",
          "normal": "ߤ",
          "shift": "ߤ"
        },
        {
          "keyId": "row-3-8",
          "normal": "ߥ",
          "shift": "ߥ"
        },
        {
          "keyId": "row-3-9",
          "normal": "ߦ",
          "shift": "ߦ"
        }
      ]
    }
  ]
}
