{
  "schemaVersion": 1,
  "languageId": "is",
  "layoutId": "icelandic-qwerty",
  "layoutName": "Icelandic QWERTY",
  "languageName": "Icelandic",
  "nativeName": "Íslenska",
  "localeTag": "is",
  "script": "Latn",
  "direction": "ltr",
  "hasCase": true,
  "inputProcessing": { "mode": "direct", "combining": false, "composition": false },
  "provenance": { "reference": "https://www.branah.com/icelandic", "verification": "layout-reviewed", "notes": "Icelandic QWERTY. ð sits after p; æ and ö on the home row after l; þ at the bottom-left of the letter block (left of z). Accented vowels á é í ó ú ý use a dead key on the real layout and are omitted from direct keys here." },
  "rows": [
    {
      "rowId": "row-0",
      "keys": [
        { "keyId": "row-0-1", "normal": "1", "shift": "!" },
        { "keyId": "row-0-2", "normal": "2", "shift": "\"" },
        { "keyId": "row-0-3", "normal": "3", "shift": "#" },
        { "keyId": "row-0-4", "normal": "4", "shift": "$" },
        { "keyId": "row-0-5", "normal": "5", "shift": "%" },
        { "keyId": "row-0-6", "normal": "6", "shift": "&" },
        { "keyId": "row-0-7", "normal": "7", "shift": "/" },
        { "keyId": "row-0-8", "normal": "8", "shift": "(" },
        { "keyId": "row-0-9", "normal": "9", "shift": ")" },
        { "keyId": "row-0-10", "normal": "0", "shift": "=" }
      ]
    },
    {
      "rowId": "row-1",
      "keys": [
        { "keyId": "row-1-1", "normal": "q", "shift": "Q" },
        { "keyId": "row-1-2", "normal": "w", "shift": "W" },
        { "keyId": "row-1-3", "normal": "e", "shift": "E" },
        { "keyId": "row-1-4", "normal": "r", "shift": "R" },
        { "keyId": "row-1-5", "normal": "t", "shift": "T" },
        { "keyId": "row-1-6", "normal": "y", "shift": "Y" },
        { "keyId": "row-1-7", "normal": "u", "shift": "U" },
        { "keyId": "row-1-8", "normal": "i", "shift": "I" },
        { "keyId": "row-1-9", "normal": "o", "shift": "O" },
        { "keyId": "row-1-10", "normal": "p", "shift": "P" },
        { "keyId": "row-1-11", "normal": "ð", "shift": "Ð" }
      ]
    },
    {
      "rowId": "row-2",
      "keys": [
        { "keyId": "row-2-1", "normal": "a", "shift": "A" },
        { "keyId": "row-2-2", "normal": "s", "shift": "S" },
        { "keyId": "row-2-3", "normal": "d", "shift": "D" },
        { "keyId": "row-2-4", "normal": "f", "shift": "F" },
        { "keyId": "row-2-5", "normal": "g", "shift": "G" },
        { "keyId": "row-2-6", "normal": "h", "shift": "H" },
        { "keyId": "row-2-7", "normal": "j", "shift": "J" },
        { "keyId": "row-2-8", "normal": "k", "shift": "K" },
        { "keyId": "row-2-9", "normal": "l", "shift": "L" },
        { "keyId": "row-2-10", "normal": "æ", "shift": "Æ" },
        { "keyId": "row-2-11", "normal": "ö", "shift": "Ö" }
      ]
    },
    {
      "rowId": "row-3",
      "keys": [
        { "keyId": "row-3-1", "normal": "þ", "shift": "Þ" },
        { "keyId": "row-3-2", "normal": "z", "shift": "Z" },
        { "keyId": "row-3-3", "normal": "x", "shift": "X" },
        { "keyId": "row-3-4", "normal": "c", "shift": "C" },
        { "keyId": "row-3-5", "normal": "v", "shift": "V" },
        { "keyId": "row-3-6", "normal": "b", "shift": "B" },
        { "keyId": "row-3-7", "normal": "n", "shift": "N" },
        { "keyId": "row-3-8", "normal": "m", "shift": "M" },
        { "keyId": "row-3-9", "normal": ",", "shift": ";" },
        { "keyId": "row-3-10", "normal": ".", "shift": ":" },
        { "keyId": "row-3-11", "normal": "-", "shift": "_" }
      ]
    }
  ]
}
