{
  "schemaVersion": 1,
  "languageId": "os",
  "layoutId": "ossetian-jcuken",
  "layoutName": "Ossetian (ЙЦУКЕН)",
  "languageName": "Ossetian",
  "nativeName": "Ирон",
  "localeTag": "os",
  "script": "Cyrl",
  "direction": "ltr",
  "hasCase": true,
  "inputProcessing": {
    "mode": "direct",
    "combining": false,
    "composition": false
  },
  "provenance": {
    "reference": "https://www.branah.com/russian",
    "verification": "unverified",
    "notes": "Built on the Russian ЙЦУКЕН skeleton with the extra Ossetian letter ӕ appended. Ossetian also uses the digraph гъ and others typed as sequences of existing keys. Physical placement of the extra key on a real Ossetian layout is not confirmed. Cyrillic is bicameral, so Shift = uppercase."
  },
  "rows": [
    {
      "rowId": "row-0",
      "keys": [
        { "keyId": "row-0-1", "normal": "1", "shift": "!" },
        { "keyId": "row-0-2", "normal": "2", "shift": "\"" },
        { "keyId": "row-0-3", "normal": "3", "shift": "№" },
        { "keyId": "row-0-4", "normal": "4", "shift": ";" },
        { "keyId": "row-0-5", "normal": "5", "shift": "%" },
        { "keyId": "row-0-6", "normal": "6", "shift": ":" },
        { "keyId": "row-0-7", "normal": "7", "shift": "?" },
        { "keyId": "row-0-8", "normal": "8", "shift": "*" },
        { "keyId": "row-0-9", "normal": "9", "shift": "(" },
        { "keyId": "row-0-10", "normal": "0", "shift": ")" },
        { "keyId": "row-0-11", "normal": "ё", "shift": "Ё" }
      ]
    },
    {
      "rowId": "row-1",
      "keys": [
        { "keyId": "row-1-1", "normal": "й", "shift": "Й" },
        { "keyId": "row-1-2", "normal": "ц", "shift": "Ц" },
        { "keyId": "row-1-3", "normal": "у", "shift": "У" },
        { "keyId": "row-1-4", "normal": "к", "shift": "К" },
        { "keyId": "row-1-5", "normal": "е", "shift": "Е" },
        { "keyId": "row-1-6", "normal": "н", "shift": "Н" },
        { "keyId": "row-1-7", "normal": "г", "shift": "Г" },
        { "keyId": "row-1-8", "normal": "ш", "shift": "Ш" },
        { "keyId": "row-1-9", "normal": "щ", "shift": "Щ" },
        { "keyId": "row-1-10", "normal": "з", "shift": "З" },
        { "keyId": "row-1-11", "normal": "х", "shift": "Х" },
        { "keyId": "row-1-12", "normal": "ъ", "shift": "Ъ" }
      ]
    },
    {
      "rowId": "row-2",
      "keys": [
        { "keyId": "row-2-1", "normal": "ф", "shift": "Ф" },
        { "keyId": "row-2-2", "normal": "ы", "shift": "Ы" },
        { "keyId": "row-2-3", "normal": "в", "shift": "В" },
        { "keyId": "row-2-4", "normal": "а", "shift": "А" },
        { "keyId": "row-2-5", "normal": "п", "shift": "П" },
        { "keyId": "row-2-6", "normal": "р", "shift": "Р" },
        { "keyId": "row-2-7", "normal": "о", "shift": "О" },
        { "keyId": "row-2-8", "normal": "л", "shift": "Л" },
        { "keyId": "row-2-9", "normal": "д", "shift": "Д" },
        { "keyId": "row-2-10", "normal": "ж", "shift": "Ж" },
        { "keyId": "row-2-11", "normal": "э", "shift": "Э" },
        { "keyId": "row-2-12", "normal": "ӕ", "shift": "Ӕ" }
      ]
    },
    {
      "rowId": "row-3",
      "keys": [
        { "keyId": "row-3-1", "normal": "я", "shift": "Я" },
        { "keyId": "row-3-2", "normal": "ч", "shift": "Ч" },
        { "keyId": "row-3-3", "normal": "с", "shift": "С" },
        { "keyId": "row-3-4", "normal": "м", "shift": "М" },
        { "keyId": "row-3-5", "normal": "и", "shift": "И" },
        { "keyId": "row-3-6", "normal": "т", "shift": "Т" },
        { "keyId": "row-3-7", "normal": "ь", "shift": "Ь" },
        { "keyId": "row-3-8", "normal": "б", "shift": "Б" },
        { "keyId": "row-3-9", "normal": "ю", "shift": "Ю" },
        { "keyId": "row-3-10", "normal": ".", "shift": "," }
      ]
    }
  ]
}
