{
  "schemaVersion": 1,
  "languageId": "lt",
  "layoutId": "lithuanian-standard",
  "layoutName": "Lithuanian (Standard)",
  "languageName": "Lithuanian",
  "nativeName": "Lietuvių",
  "localeTag": "lt",
  "script": "Latn",
  "direction": "ltr",
  "hasCase": true,
  "inputProcessing": {
    "mode": "direct",
    "combining": false,
    "composition": false
  },
  "provenance": {
    "reference": "https://www.branah.com/lithuanian",
    "verification": "unverified",
    "notes": "Lithuanian (Standard) layout. On the physical keyboard the number row carries ą č ę ė į š ų ū ž and the digits move to shift/AltGr; here row-0 shows those special letters with digits on shift, and the remaining ž/ū are appended to a letter row. Letter order follows QWERTY. Approximated; not independently re-verified."
  },
  "rows": [
    {
      "rowId": "row-0",
      "keys": [
        {
          "keyId": "row-0-1",
          "normal": "ą",
          "shift": "Ą"
        },
        {
          "keyId": "row-0-2",
          "normal": "č",
          "shift": "Č"
        },
        {
          "keyId": "row-0-3",
          "normal": "ę",
          "shift": "Ę"
        },
        {
          "keyId": "row-0-4",
          "normal": "ė",
          "shift": "Ė"
        },
        {
          "keyId": "row-0-5",
          "normal": "į",
          "shift": "Į"
        },
        {
          "keyId": "row-0-6",
          "normal": "š",
          "shift": "Š"
        },
        {
          "keyId": "row-0-7",
          "normal": "ų",
          "shift": "Ų"
        },
        {
          "keyId": "row-0-8",
          "normal": "ū",
          "shift": "Ū"
        },
        {
          "keyId": "row-0-9",
          "normal": "9",
          "shift": "("
        },
        {
          "keyId": "row-0-10",
          "normal": "0",
          "shift": ")"
        },
        {
          "keyId": "row-0-11",
          "normal": "ž",
          "shift": "Ž"
        }
      ]
    },
    {
      "rowId": "row-1",
      "keys": [
        {
          "keyId": "row-1-1",
          "normal": "q",
          "shift": "Q"
        },
        {
          "keyId": "row-1-2",
          "normal": "w",
          "shift": "W"
        },
        {
          "keyId": "row-1-3",
          "normal": "e",
          "shift": "E"
        },
        {
          "keyId": "row-1-4",
          "normal": "r",
          "shift": "R"
        },
        {
          "keyId": "row-1-5",
          "normal": "t",
          "shift": "T"
        },
        {
          "keyId": "row-1-6",
          "normal": "y",
          "shift": "Y"
        },
        {
          "keyId": "row-1-7",
          "normal": "u",
          "shift": "U"
        },
        {
          "keyId": "row-1-8",
          "normal": "i",
          "shift": "I"
        },
        {
          "keyId": "row-1-9",
          "normal": "o",
          "shift": "O"
        },
        {
          "keyId": "row-1-10",
          "normal": "p",
          "shift": "P"
        }
      ]
    },
    {
      "rowId": "row-2",
      "keys": [
        {
          "keyId": "row-2-1",
          "normal": "a",
          "shift": "A"
        },
        {
          "keyId": "row-2-2",
          "normal": "s",
          "shift": "S"
        },
        {
          "keyId": "row-2-3",
          "normal": "d",
          "shift": "D"
        },
        {
          "keyId": "row-2-4",
          "normal": "f",
          "shift": "F"
        },
        {
          "keyId": "row-2-5",
          "normal": "g",
          "shift": "G"
        },
        {
          "keyId": "row-2-6",
          "normal": "h",
          "shift": "H"
        },
        {
          "keyId": "row-2-7",
          "normal": "j",
          "shift": "J"
        },
        {
          "keyId": "row-2-8",
          "normal": "k",
          "shift": "K"
        },
        {
          "keyId": "row-2-9",
          "normal": "l",
          "shift": "L"
        }
      ]
    },
    {
      "rowId": "row-3",
      "keys": [
        {
          "keyId": "row-3-1",
          "normal": "z",
          "shift": "Z"
        },
        {
          "keyId": "row-3-2",
          "normal": "x",
          "shift": "X"
        },
        {
          "keyId": "row-3-3",
          "normal": "c",
          "shift": "C"
        },
        {
          "keyId": "row-3-4",
          "normal": "v",
          "shift": "V"
        },
        {
          "keyId": "row-3-5",
          "normal": "b",
          "shift": "B"
        },
        {
          "keyId": "row-3-6",
          "normal": "n",
          "shift": "N"
        },
        {
          "keyId": "row-3-7",
          "normal": "m",
          "shift": "M"
        },
        {
          "keyId": "row-3-8",
          "normal": ",",
          "shift": ";"
        },
        {
          "keyId": "row-3-9",
          "normal": ".",
          "shift": ":"
        },
        {
          "keyId": "row-3-10",
          "normal": "-",
          "shift": "_"
        }
      ]
    }
  ]
}
